{
  "adapter_id": "luma_ray_3_2_modify_v2026_07_30",
  "provider": "Luma AI",
  "model_id": "Ray 3.2 Modify Video",
  "surface": "Dream Machine / official surface; API probe required",
  "status": "current",
  "verified_at": "2026-07-30",
  "ttl_days": 30,
  "source_ids": [
    "S057",
    "S058"
  ],
  "native_capabilities": {
    "source_video": true,
    "text_prompt": true,
    "motion_control": "Off or 1–9",
    "structure_control": "Off or 1–9",
    "faces_control": true,
    "bodies_poses_modes": [
      "Poses",
      "Blocking"
    ]
  },
  "reference_capabilities": {
    "motion": "source video + Motion",
    "structure": "source video + Structure",
    "skeletal_adherence": "Poses",
    "coarse_staging": "Blocking"
  },
  "prompt_only": [
    "laban labels",
    "facs labels beyond reference",
    "camera changes not exposed by workflow"
  ],
  "unsupported": [],
  "validation_rules": [
    "Poses and Blocking have different adherence behavior.",
    "Preservation controls can dominate prompt; save exact settings."
  ],
  "request_template": {
    "source_video": "${video}",
    "prompt": "${prompt}",
    "motion": "${0_to_9_or_off}",
    "structure": "${0_to_9_or_off}",
    "bodies": "${poses_or_blocking}",
    "faces": "${setting}"
  },
  "loss_risk": {
    "style_vs_motion_tradeoff": "medium",
    "contact_when_structure_low": "high"
  },
  "provenance": {
    "provenance_class": "ESTABLISHED",
    "source_ids": [
      "S057",
      "S058"
    ],
    "confidence": 0.93
  }
}
